03-02-21,FALSE,FALSE,#NAME?,,#NAME?,#NAME?,Aquatic Pollutants Joint Transnational Call,,,,,,,,,http://jpi-oceans.eu/calls/proposals/aquaticpollutants-joint-transnational-call-2020,"The Joint Programming Initiatives (JPIs) on Water, Oceans and Antimicrobial Resistance (AMR) announces a call for research and innovation projects on risks posed to human health and the environment by pollutants and pathogens present in water resources. A total of €22.6 million has been allocated for this call. There is no limit of total budget for proposals. Each consortium must be composed of eligible independent entities from a minimum of three different EU Member States or H2020 Associated countries (listed in the announcement). The pre-proposal submission deadline is 16 April 2020.",,,International,JPI Oceans,,,,,,,,,,,,,,,16-Apr-20,,,,#NAME?,,,,FALSE
03-04-21,TRUE,TRUE,#NAME?,,#NAME?,#NAME?,Crowdfunding Training Opportunity,Fellowships scholarships or trainings,Miscellaneous,Funding strategies,Crawd funding,Courses,,,,https://www.globalgiving.org/accelerator/,"GlobalGiving is an online platform to raise funds for grassroots projects worldwide across many sectors and themes – including in agriculture, energy, environment, and natural resources. GlobalGiving announces a new Accelerator program that will offer virtual training in online fundraising and participation in a two-week crowdfunding campaign. The program is open to nonprofit organizations anywhere in the world. Organizations that successfully complete the GlobalGiving Accelerator by raising at least US$5 thousand total from a minimum 40 different donors will earn permanent membership with GlobalGiving and up to US$30 thousand in match funding and additional bonus prizes. The application deadline is 17 April 2020.",,,USA,Global Giving,,,,,,,,,,,,,,yearly,17-Apr-20,,,,#NAME?,,,,FALSE
03-02-21,FALSE,FALSE,#NAME?,,#NAME?,#NAME?,Environmental Health Sciences Core Centers (EHSCC) (P30 Clinical Trial Optional),Research and publications,Environmental sciences,,,,,,,https://www.mendeley.com/research-funding/opportunities/300127327,,,,,National Institutes of Health,,,,Commercial Organizations,,,Local or State Governments,,,Not specified,,,,,17-Apr-20,,,,#NAME?,,,,FALSE
03-04-21,TRUE,TRUE,#NAME?,,#NAME?,#NAME?,Ocean Science Journalism Fellowship,Fellowships scholarships or trainings,Journalism,Ocean Sciences,,,,,,https://www.whoi.edu/press-room/journalism-fellowship/,"WHOI invites professional science writers, journalists, producers, and editors from all around the world to apply for the one-week residential Ocean Science Journalism Fellowship. The program is designed to introduce science journalists to the interdisciplinary and wide-ranging fields of oceanography and ocean engineering through seminars, laboratory visits, and brief field expeditions. WHOI covers room and board during the program. Fellows will receive a travel allowance of US$1,200. The application deadline is 17 April 2020.",,,USA,Woods Hole Oceanographic Institution,,,,,,,,,,,,,,periodic,17-Apr-20,,,,#NAME?,,,,FALSE
6/16/2020,FALSE,FALSE,#NAME?,,#NAME?,#NAME?,Research Grants 2020,,,,,,,,,http://www.nagaofoundation.or.jp/e/research/research.html,"The NEF Research Grants fund research in support of nature conservation, emphasizing developing countries in the Asia-Pacific region. Applicants should be nationals of Asian-Pacific countries, and research projects should be carried out in their home countries: Bangladesh, Bhutan, Cambodia, Fiji, Indonesia, Kiribati, Lao PDR, Malaysia, Maldives, Marshall Islands, Micronesia, Mongolia, Myanmar, Nauru, Nepal, Palau, Papua New Guinea, the Philippines, Samoa, Solomon Islands, Sri Lanka, Thailand, Timor-Leste, Tonga, Tuvalu, Vanuatu, and Vietnam. Grants are a maximum of 500 thousand Japanese yen for a maximum of two years. The grant is intended for early-career researchers. The closing dates for applications are 17 April 2020 and 14 October 2020.",,,Japan,Nagao Natural Environment Foundation,,,,,,,,,,,,,,semiannual,17-Apr-20,14-oct-20,,,#NAME?,,,,FALSE
03-04-21,FALSE,FALSE,#NAME?,,#NAME?,#NAME?,EMBRC Services for Early-Career Researchers,Equipment/Supplies or Facilities,Agricultural and Biological Sciences,Marine Biology,Marine Ecology,Ocean Sciences,,,,http://www.euromarinenetwork.eu/calls/joint-euromarine-embrc-2020-call-proposals,The European Marine Biological Research Centre (EMBRC) offers grants for services to 10 EuroMarine early-career scientists (PhD students or researchers within 5 years of their PhD degree). Applicants must belong to an organization that is a member of EuroMarine. Each successful applicant will receive a grant of €5 thousand to cover the cost of EMBRC services. The deadline for proposal submission is 19 April 2020.,,Applicants must belong to an organization that is a member of EuroMarine,International,EuroMarine,,,,,,,,,,,,,,periodic,19-Apr-20,,,,#NAME?,,,,FALSE
6/16/2020,FALSE,FALSE,#NAME?,,#NAME?,#NAME?,FRQ Support for NFRF 2020 Horizon Competition: Combined clean biofuel production and phytoremediation solutions from contaminated lands worldwide,Contract tender or cooperative agreement,Biochemistry Genetics and Molecular Biology,,,,,,,https://www.mendeley.com/research-funding/opportunities/501300248262,,,,,Fonds de Recherche du Québec - Santé,,,,Mid-Career and Experienced Researchers,,,,,,"Up to 4,000,000 EUR",,,,,20-Apr-20,,,,#NAME?,,,,FALSE
6/16/2020,FALSE,FALSE,#NAME?,,#NAME?,#NAME?,FRQ Support for to 2020 Horizon Global Platform Competition: Combined clean biofuel production and phytoremediation solutions from contaminated lands worldwide,Programs and projects,Biochemistry Genetics and Molecular Biology,,,,,,,https://www.mendeley.com/research-funding/opportunities/501300248293,,,,,Fonds de recherche du Québec – Nature et technologies,,,,Mid-Career and Experienced Researchers,,,,,,"Up to 4,000,000 EUR",,,,,20-Apr-20,,,,#NAME?,,,,FALSE
6/25/2020,FALSE,FALSE,#NAME?,,#NAME?,#NAME?,Postdoctoral Research Opportunity in Hydrology,Research and publications,Agricultural and Biological Sciences,Environmental sciences,,,,,,https://www.mendeley.com/research-funding/opportunities/300120712,,,,,Oak Ridge Associated Universities,,,,Mid-Career and Experienced Researchers,,,,,,Not specified,,,,,20-Apr-20,,,,#NAME?,,,,FALSE
03-04-21,FALSE,FALSE,#NAME?,,#NAME?,#NAME?,Reducing Deforestation and Forest Degradation,,,,,,,,,https://grants.mfa.no/#call/1801,"Norway’s International Climate and Forest Initiative (NICFI) supports efforts to reduce greenhouse gas emissions resulting from deforestation and forest degradation in developing countries. Civil society organizations are invited to submit proposals for projects that reverse and reduce the loss of tropical forests. Priority geographic focus for funding are Brazil, Colombia, Peru, Ecuador, Guyana, DR Congo, Gabon, the Republic of Congo, Liberia, Ethiopia and Indonesia. However, strategic projects focusing on other important tropical forest countries will also be considered. Projects should cover a five-year period. Priority will be given to projects with a total budget above NOK 20 million. The deadline for applications is 20 April 2020.",,,Norway,Norway’s International Climate and Forest Initiative,,,,,,,,,,,,,,,20-Apr-20,,,,#NAME?,,,,FALSE
08-01-22,FALSE,FALSE,#NAME?,,#NAME?,#NAME?,Catalyst: Seeding General,Programs and projects,Chemical and Bio Engineering,,,,,,,https://www.mendeley.com/research-funding/opportunities/501300207271,,,,,Royal Society of New Zealand,,,,,,,,,,"Up to 80,000 NZD",,,,,22-Apr-20,,,,#NAME?,,,,FALSE
4/13/2021,FALSE,TRUE,#NAME?,,#NAME?,#NAME?,Convocatoria de EOI: Iniciativa de investigación sobre género en STEM,Programs and projects,Human and Social Sciences,"Mathematics, Statistics and Computer Sciences",,,,,,https://www.idrc.ca/en/funding/call-expressions-interest-gender-stem-research-initiative-advancing-gender-analysis-and,"nueva oportunidad de financiación para promover el análisis de género y el liderazgo de las mujeres en los campos de ciencia, tecnología, ingeniería y matemáticas (STEM) a través de la Iniciativa de investigación de género en STEM.",El objetivo último es incrementar la contribución de la ciencia a la igualdad de género.,,,Centro Internacional de Investigaciones para el Desarrollo (IDRC) de Canadá,"Esta convocatoria de manifestaciones de interés está abierta a universidades públicas de países de ingresos bajos y medianos (PIBM) de África, Asia o América Latina / el Caribe que hayan demostrado su experiencia en investigación sobre cuestiones de género en los campos STEM.",,,,,,,,CA,,1000000,"1,250,000",,,22-Apr-20,,,,#NAME?,,,,FALSE
03-04-21,FALSE,TRUE,#NAME?,,#NAME?,#NAME?,National Geographic Early Career Grant,Research and publications,Miscellaneous,,,,,,,https://www.nationalgeographic.org/funding-opportunities/grants/what-we-fund/,"The National Geographic Society supports experienced project leaders in the areas of conservation, education, research, storytelling, and technology. The applicant must demonstrate successful completion of similar projects with measurable and/or tangible results to be eligible. Projects are typically funded for between US$10 thousand and US$30 thousand. The next application deadline is 22 April 2020.",,"No se requiere titulo de posgrado.  Personas con menos de 5 años de experiencia profesional en el campo de aplicacion deben aplicar a ""Exploration Grants"" en su lugar",USA,National Geographic,worldwide,,,Individuals,,,,1 año,dolares,,,10,5000,currently suspended,22-Apr-20,,,,#NAME?,01-Aug-20,,"An Early Career Grant offers individuals their first opportunity to lead their own project. No advanced degree is needed, although evidence of prior experience is expected.",FALSE
03-04-21,FALSE,TRUE,#NAME?,,#NAME?,#NAME?,National Geographic Early-Career Grant,Research and publications,,,,,,,,https://www.nationalgeographic.org/funding-opportunities/grants/what-we-fund/#EarlyCareer,The National Geographic Society accepts applications from less experienced individuals who seek to lead a project. Applicants are not required to have an advanced degree and should submit their proposal at least four months before the project start date. Grants are typically funded for less than US $5 thousand but requests for up to US $10 thousand will also be considered. The next application deadline is 22 April 2020.,,,USA,National Geographic Society,,,,,,,,,,,,,,currently suspended,22-Apr-20,31-oct-20,,,#NAME?,,,,FALSE
03-04-21,FALSE,TRUE,#NAME?,,#NAME?,#NAME?,National Geographic Exploration Grant,Programs and projects,Environmental sciences,,,,,,,https://www.nationalgeographic.org/funding-opportunities/grants/what-we-fund/,,,,USA,National Geographic,worldwide,,,Individuals,,,,1 año,,,10,30,,currently suspended,22-Apr-20,,,,#NAME?,01-may-20,si,,FALSE
03-04-21,FALSE,TRUE,#NAME?,,#NAME?,#NAME?,National Geographic request for proposals: Enduring Impacts_Archaeology of Sustainability,Programs and projects,Environmental sciences,,,,,,,https://www.nationalgeographic.org/funding-opportunities/grants/what-we-fund/enduring-impacts/,Generar conocimientos de la física y la fisiología del buceo deportivo que beneficien al público en general y sumen a la comprensión científica de la relación y la capacidad del hombre para sobrevivir en el medio ambiente submarino.,,,USA,National Geographic,worldwide,,"Producción de bases de datos arqueológicos, paleclimatológicos y paleoambientales. Sostenibilidiad y resiliencia en el contexto arqueologico",Individuals,,,,,,,,80,,currently suspended,22-Apr-20,,,,#NAME?,01-may-20,,"Recopilación y el análisis de datos arqueológicos, paleoambientales y paleoclimatológicos con el fin de aumentar nuestra comprensión de las interacciones entre el hombre y el medio ambiente a lo largo del tiempo, para contribuir en última instancia a mitigar las crisis ambientales y climáticas contemporáneas.",FALSE
03-02-21,FALSE,FALSE,#NAME?,,#NAME?,#NAME?,Stories of Tropical Rainforests,,,,,,,,,https://www.nationalgeographic.org/funding-opportunities/grants/what-we-fund/tropical-rainforest-story/,"The National Geographic Society (NatGeo) supports storytelling projects that highlight attempts to mitigate or reverse human impacts on tropical rainforests. Priority for this RFP will be given to projects led by journalists and storytellers from countries within the Amazon River basin, Congo River basin, and rainforests in Southeast Asia. Proposals will be funded from US$5 thousand to US$70 thousand. Application deadline for this call is 22 April 2020, however, candidates who wish to submit a Letter of Intent in Spanish, Portuguese, or Bahase need to submit their LOI by 15 April.",,,USA,National Geographic Society,,,,,,,,,,,,,,,22-Apr-20,,,,#NAME?,,,,FALSE
03-04-21,TRUE,TRUE,#NAME?,,#NAME?,#NAME?,Postdoctoral Fellowships for Young Marine Scientists,Fellowships scholarships or trainings,Environmental sciences,Agricultural and Biological Sciences,Ocean Sciencs,Marine Biology,Marine Ecology,,,https://www.labexmer.eu/en/international/postdoctoral-fellowships,"LabexMER is a program of France's Ministry of Research and Education to address key questions about the global ocean, the deep ocean, and the coastal ocean. LabexMER offers four two-year postdoctoral fellowships for international young scientists to propose research projects in marine sciences to be carried out in one or several LabexMER laboratories in western France. Fellows will receive an annual salary of €37 thousand and support to cover travel expenses, equipment and supplies (€5 thousand per year). The deadline for applications is 23 April 2020.",,,France,French Ministry of Research and Education,,,,,,,,,,,,,,,23-Apr-20,,,,#NAME?,,,,FALSE
6/16/2020,FALSE,FALSE,#NAME?,,#NAME?,#NAME?,Empowering Women and Girls living in Extreme Poverty,,,,,,,,,https://diningforwomen.org/learn/grants/apply-for-a-grant/,"Dining for Women makes grants to non-profit organizations that support women and girls living in extreme poverty in developing countries. Thematic areas include access to clean water and sanitation, food security, and education, among other themes. Applicants may request between US$35 thousand to US$50 thousand. Eligibility extends to US 5.01(c)3 corporations or international organisations with a fiscal sponsor. Dining for Women has two annual grant cycles. The submission deadlines for 2020 are 24 April and 24 October 2020.",,,USA,Dining for Women,,,,,,,,,,,,,,semiannual,24-Apr-20,24-oct-20,,,#NAME?,,,,FALSE
11/26/2020,FALSE,FALSE,#NAME?,,#NAME?,#NAME?,Animal Health and Production and Animal Products: Welfare and Well-being of Agricultural Animals,Programs and projects,Agricultural and Biological Sciences,,,,,,,https://www.mendeley.com/research-funding/opportunities/300125339,,,,,National Institute of Food and Agriculture,,,,Non-profit Organizations,,,Academic Institutions,,,"Up to 650,000 USD with total funding of 36,800,000 USD",,,,,29-Apr-20,,,,#NAME?,,,,FALSE
12/13/2020,FALSE,FALSE,#NAME?,,#NAME?,#NAME?,Seed Fund for returned NMRC Fellows and Scholars - Nov 2019,Programs and projects,Agricultural and Biological Sciences,,,,,,,https://www.mendeley.com/research-funding/opportunities/501300244108,,,,,National Research Foundation Singapore,,,,,,,,,,"Total funding 30,000 SGD",,,,,29-Apr-20,,,,#NAME?,,,,FALSE
12/13/2020,FALSE,FALSE,#NAME?,,#NAME?,#NAME?,Transforming the UK food system for healthy people and a healthy environment call and workshops,Programs and projects,Agricultural and Biological Sciences,,,,,,,https://www.mendeley.com/research-funding/opportunities/501300246117,,,,,Economic and Social Research Council / Natural Environment Research Council,,,,Academic Institutions,Non-profit Organizations,Mid-Career and Experienced Researchers,,,,"Up to 6,000,000 GBP with total funding of 47,500,000 GBP",,,,,29-Apr-20,,,,#NAME?,,,,FALSE
6/16/2020,FALSE,FALSE,#NAME?,,#NAME?,#NAME?,Andreas Acrivos Dissertation Award in Fluid Dynamics,Prizes and Awards,Chemical and Bio Engineering,Environmental sciences,,,,,,https://www.mendeley.com/research-funding/opportunities/300048566,,,,,American Physical Society,,,,Graduate Students,,,Early Career and New Faculty Researchers,,,"Up to 1,000 USD",,,,,30-Apr-20,,,,#NAME?,,,,FALSE
4/13/2021,TRUE,TRUE,#NAME?,,#NAME?,#NAME?,BID lanza PPC para proyectos regionales en América Latina y el Caribe,Programs and projects,Human and Social Sciences,,,,,,,https://www.iadb.org/en/news/idb-launches-2021-call-proposals-regional-projects-latin-america-and-caribbean,"Fortalecimiento de cadenas de valor regionales;
Economía digital;
Apoyo a las pequeñas y medianas empresas (PYME);
Igualdad y diversidad de género ; y
Cambio climático .",La Iniciativa BPR proporciona financiamiento no reembolsable para soluciones a desafíos de desarrollo compartidos a través de la cooperación regional entre al menos tres países miembros prestatarios del BID.,,,,,,,,,,,,,0,,,,,30-Apr-20,,,,#NAME?,,,,FALSE
4/13/2021,TRUE,TRUE,#NAME?,,#NAME?,#NAME?,El Servicio de Pesca y Vida Silvestre de EE. UU. Anuncia el Programa Regional de América Latina 2021,Programs and projects,Conservation,Agricultural and Biological Sciences,,,,,,https://www.grants.gov/web/grants/view-opportunity.html?oppId=332290,"conservar especies, hábitats y procesos ecológicos prioritarios en paisajes con alto valor de biodiversidad en la región.",El programa regional de América Latina solicita propuestas para reducir las amenazas a la vida silvestre y los ecosistemas clave y para fortalecer la capacidad individual e institucional local para sostener los procesos de conservación a largo plazo.,,,,Uso sostenible de recursos y conflicto entre humanos y vida silvestre: Patagonia ( Chile y Argentina ).,,,,,,,,,100000,200000,,,,30-Apr-20,,,,#NAME?,,,,FALSE
6/16/2020,FALSE,FALSE,#NAME?,,#NAME?,#NAME?,Grants for Environment 2020,,,,,,,,,https://thelawrencefoundation.org/application-process/,"The Lawrence Foundation makes grants to U.S. nonprofit organizations for projects in environment, human services, and other themes. There is no restriction on the geographical area where grant activities can be implemented. The average grant size is between US$5 thousand and US$10 thousand. The deadlines for applications are 30 April and 31 October of each year.",,,USA,Lawrence Foundation,,,,,,,,,,,,,,,30-Apr-20,31-oct-20,,,#NAME?,,,,FALSE
6/14/2020,FALSE,FALSE,#NAME?,,#NAME?,#NAME?,International Small World Competition 2020,,,,,,,,,https://www.nikonsmallworld.com/galleries/photomicrography-competition/rules,"The Nikon Small World Competition is open to anyone with an interest in photography through the microscope. Each year, the top 20 prize-winners are exhibited at numerous museums and science centers throughout the United States and Canada. The Top 3 winners will receive up to US$3 thousand. Only photomicrographs are eligible. Entries must be received no later than 30 April 2020.",,,Japan,Nikon,,,,,,,,,,,,,,,30-Apr-20,,,,#NAME?,,,,FALSE
6/16/2020,FALSE,FALSE,#NAME?,,#NAME?,#NAME?,JRD-Tata Fellowships for Visiting Scientists from Developing Countries,,,,,,,,,http://insaindia.res.in/fellows.php,"India's National Science Academy administers the JRD-Tata Fellowships to support visiting scientists from the developing world and promote South-South cooperation. The program is open to applicants from developing countries (except India) younger than age 45, and who possess doctorate or masters degrees in science or equivalent degrees in engineering/medicine. Past participants have included several in agriculture, biological sciences, and geo-sciences. The fellowship is for three months and includes transportation, maintenance allowance, accommodation, and contingencies. The application deadlines are 30 April and 31 October of each year.",,,India,Indian National Academy of Sciences,,,,,,,,,,,,,,semiannual,30-Apr-20,31-oct-20,,,#NAME?,,,,FALSE
03-04-21,TRUE,TRUE,#NAME?,,#NAME?,#NAME?,Patagonia - Environmental Grants,Programs and projects,Environmental sciences,Biodiversity and Wildlife Conservation,,,,,,http://www.patagonia.com/international-grants.html,"Patagonia makes grants to support nonprofit organizations for campaigns to preserve and protect the environment. The funding range for Latin America is typically between US$8 to $12 thousand. At this time, the Latin America Grants Program is only available in Chile and Argentina. Proposals have to be submitted online before 30 April or 31 August each year. (Note: Patagonia also supports grant programs in developed countries with different deadlines.)",,,USA,Patagonia,,,,,,,,,,,,,,semiannual,30-Apr-20,30-Aug-20,,,#NAME?,,,,TRUE
4/13/2021,TRUE,TRUE,#NAME?,,#NAME?,#NAME?,Premio creatividad de las mujeres en la vida rural,Prizes and Awards,Human and Social Sciences,Sustainable Development,,,,,,https://www.woman.ch/campaign-17-days/wwsf-prize-for-womens-creativity-in-rural-life/,"El premio tiene como objetivo llamar la atención internacional sobre las contribuciones de los galardonados al desarrollo sostenible, la seguridad alimentaria y la paz de los hogares , generando así reconocimiento y apoyo para sus proyectos.",Subraye cómo el trabajo del candidato promueve la Agenda 2030 de Desarrollo Sostenible de las Naciones Unidas: Transformar su mundo.,,,Women 's World Summit Foundation (WWSF),,,,,,,,,,0,,,,,30-Apr-20,,,,#NAME?,,,,FALSE
03-02-21,FALSE,FALSE,#NAME?,,#NAME?,#NAME?,Prize for Women's Creativity in Rural Life,,,,,,,,,https://www.woman.ch/campaign-17-days/prize-for-womens-creativity-in-rural-life/,"The Women’s World Summit Foundation (WWSF) invites nominations for its 26th annual Prize for women’s creativity in rural life. The prize honors women's groups for exceptional creativity, courage, and commitment to improve the quality of life in rural communities. Each year, between 5-10 winners receive a cash prize of US$1,000. Nominations include biographical data about the nominee; at least two endorsement letters; and labeled photos. Self-nominations are not accepted. The deadline for nominations (submitted by postal mail only) is 30 April 2020.",,,Switzerland,Women's World Summit Foundation,,,,,,,,,,,,,,,30-Apr-20,,,,#NAME?,,,,FALSE
6/16/2020,FALSE,FALSE,#NAME?,,#NAME?,#NAME?,Scholarships for International Students,,,,,,,,,https://www.freiheit.org/talent-promotion-program,The scholarship scheme is open to qualified international candidates studying full-time at German universities. International applicants from all subject areas can apply for a scholarship for their Masters degree as well as PhD. The minimum funding covers two semesters. Each grant is worth up to €850 per month. Deadlines for application are 30 April and 31 October of each year.,,,Germany,Friedrich Naumann Foundation,,,,,,,,,,,,,,,30-Apr-20,31-oct-20,,,#NAME?,,,,FALSE
6/16/2020,FALSE,FALSE,#NAME?,,#NAME?,#NAME?,"Water, Sanitation, and Waste Management",,,,,,,,,https://www.fondation-suez.com/en/,"Fonds Suez Initiatives makes grants and provides technical skills for projects in water, sanitation, and waste management in developing countries. Eligibility for grants extends to solidarity organizations and institutions. The Fund considers projects regardless of size and has no minimum amount of aid that it can provide up to 50% of the total project budget. The deadlines for applications (French, English) are 30 April and 31 October of each year.",,,France,Fonds SUEZ Initiatives,,,,,,,,,,,,,,semiannual,30-Apr-20,31-oct-20,,,#NAME?,,,,FALSE
11/26/2020,FALSE,FALSE,#NAME?,,#NAME?,#NAME?,Research and Conservation of Tortoises and Freshwater Turtles,,,,,,,,,https://turtleconservationfund.org/grant-application-guidelines/,The Turtle Conservation Fund makes grants to organizations and individuals worldwide for conservation and research of endangered and critically endangered tortoises and freshwater turtles. Most regular grants are US$2 thousand to US$5 thousand per project. The Fund also makes seed grants of US$1 thousand or less. Application deadlines for both programs are 01 May and 01 December of each year.,,,International,Turtle Conservation Fund,,,,,,,,,,,,,,semiannual,01-may-20,01-Dec-20,,,#NAME?,,,,FALSE
11/26/2020,FALSE,FALSE,#NAME?,,#NAME?,#NAME?,Research on Solid Waste,,,,,,,,,https://erefdn.org/research-grants-projects/how-to-apply-for-grant/,"The Environmental Research and Education Foundation (EREF) offers research grants on the management of solid wastes. Topics include waste minimization; recycling; waste conversion to energy, biofuels, chemicals, and other products; waste diversion to other uses; and landfills. There are no geographical restrictions on institutions that can apply. Previously awarded grants have ranged from US$15 thousand to over US$500 thousand, normally for projects of about two years. The deadlines for pre-proposals are 01 May and 01 December 2020.",,,USA,Environmental Research and Education Foundation,,,,,,,,,,,,,,semiannual,01-may-20,01-Dec-20,,,#NAME?,,,,FALSE
