12/18/2022,TRUE,TRUE,#NAME?,publicar,#NAME?,#NAME?,AgFunder — Foodtech and Agtech Accelerator,Programs and projects,Agricultural and Biological Sciences,Sustainable Development,,,,,,https://gogrow.co/the-grow-accelerator/,"El programa GROW Impact Accelerator es una aceleradora de cinco meses para empresas emergentes que operan en las nuevas fronteras de la tecnología alimentaria y la tecnología agrícola. El programa está diseñado para startups internacionales que buscan expandirse en Asia, y para startups regionales que quieren lanzarse a la escena mundial. ",,,,,,,,,,,,,USD,,,200,,,30-Jan-23,,,,#NAME?,,,,FALSE
12/18/2022,TRUE,TRUE,#NAME?,publicar,#NAME?,#NAME?,EIT Food Call — Technology Solutions in the Agri-Food Sector,Programs and projects,Agricultural and Biological Sciences,Sustainable Development,,,,,,https://www.eitfood.eu/files/Open_Innovation_Call_2023_Guidelines_Complete.pdf,"EIT Food invests in projects, organizations and individuals with innovative solutions for a healthy and more sustainable food system. EIT Food co-funds the development of commercial projects in the agrifood sector. The selected organization will receive funding of up to €600 thousand per activity for 12 months or up to €1,2 million per activity over a maximum of 24 months. Eligibility extends to consortiums of at least three eligible organizations from two different countries.",,,,,,,,,,,,,EUROS,,,600,,,13-Apr-23,,,,#NAME?,,,,FALSE
12/18/2022,TRUE,TRUE,#NAME?,publicar,#NAME?,#NAME?,International Center for Genetic Engineering and Biotechnology — Research Fellowships 2023,Fellowships scholarships or trainings,Agricultural and Biological Sciences,Engineering,Medicine and Health Sciences,,,,,https://www.icgeb.org/activities/fellowship/,"El Programa de Becas Arturo Falaschi ofrece becas de larga y corta duración para ayudar a la formación de científicos de los Estados miembros del CIIGB, incluidos muchos países en desarrollo. Las becas son para investigación en universidades colaboradoras del Reino Unido, Italia, India y Sudáfrica. Para las becas de doctorado de corta duración, ",,,,,,,,,,,,,,,,,,,31-mar-23,31/09/2023,,,#NAME?,,,,FALSE
12/18/2022,TRUE,TRUE,#NAME?,publicar,#NAME?,#NAME?,Global Water Intelligence — Global Water Awards 2023,Prizes and Awards,Agricultural and Biological Sciences,Engineering,Medicine and Health Sciences,,,,,https://globalwaterawards.com/the-process/,"Están abiertas las candidaturas para los premios anuales Global Water Awards 2023. Global Water Intelligence busca tecnologías, plantas, proyectos y empresas que contribuyan significativamente al desarrollo del sector del agua. Las áreas de interés incluyen el tratamiento del agua o de las aguas residuales, la conservación y gestión del agua, las tecnologías industriales ecológicamente sostenibles y las soluciones comerciales, entre otras.",,,,,,,,,,,,,,,,,,,23-feb-23,,,,#NAME?,,,,FALSE
12/18/2022,TRUE,TRUE,#NAME?,publicar,#NAME?,#NAME?,Bristol Myers Squibb — Lead2030 Challenge for SDG 12 (Responsible Consumption and Production),Prizes and Awards,Environmental sciences,Sustainable Development,Engineering,,,,,https://www.oneyoungworld.com/lead2030/22-23/challenge-sdg12bms,"El reto Young One World Lead2030 para el ODS 12 pretende reducir los residuos y la liberación de toxinas en el medio ambiente, lo que en última instancia mejorará los resultados en materia de salud. Los proyectos deben centrarse en la relación entre los residuos y la salud, los programas de reciclaje o reutilización para particulares o empresas, o la prevención del desperdicio y la pérdida de alimentos. El reto acepta soluciones de jóvenes innovadores (18-30 años).",,,,,,,,,,,,,,,,,,,31-Jan-23,,,,#NAME?,,,,FALSE
12/18/2022,TRUE,TRUE,#NAME?,publicar,#NAME?,#NAME?,German Federal Environmental Foundation — PhD Fellowships,Fellowships scholarships or trainings,Environmental sciences,,,,,,,https://www.dbu.de/2821.html,La Fundación Federal Alemana de Medio Ambiente (DBU) ofrece 60 becas de investigación al año a jóvenes científicos de Alemania y de otros países en todas las disciplinas de la protección del medio ambiente.,,,,,,,,,,,,,,,,,,,15-Jan-23,15-jun-23,,,#NAME?,,,,FALSE
12/18/2022,TRUE,TRUE,#NAME?,publicar,#NAME?,#NAME?,Rotary Foundation — Masters Studies in Water and Sanitation 2023-24,Fellowships scholarships or trainings,Environmental sciences,,,,,,,https://www.un-ihe.org/rotary-scholarships-water-and-sanitation-professionals,La Fundación Rotaria colabora con la UNESCO para ofrecer financiación para estudios de maestría en agua y saneamiento. Los solicitantes de la ayuda de Rotary deben estar admitidos provisionalmente en uno de los tres programas de grado participantes en el Instituto para la Educación relativa al Agua (IHE) de la UNESCO. Los estudiantes presentan su solicitud a través de su club o distrito rotario local.,,,,,,,,,,,,,EUROS,,,34,,,01-Apr-23,,,,#NAME?,,,,FALSE
12/18/2022,TRUE,TRUE,#NAME?,publicar,#NAME?,#NAME?,Calouste Gulbenkian Foundation — Calouste Gulbenkian Prize 2022,Prizes and Awards,Environmental sciences,Sustainable Development,Human and Social Sciences,,,,,https://gulbenkian.pt/en/the-foundation/gulbenkian-prize-for-humanity/,"La Fundación Calouste Gulbenkian busca candidaturas para el Premio Gulbenkian de la Humanidad 2022. La 4ª edición del Premio pone de relieve el compromiso con la acción climática urgente. El Premio Gulbenkian de la Humanidad, dotado con un millón de euros, tiene como objetivo reconocer a personas, grupos u organizaciones de todo el mundo cuyas contribuciones a la mitigación y adaptación al cambio climático destaquen por su novedad, innovación e impacto. ",,,,,,,,,,,,,,,,,,,17-mar-23,,,,#NAME?,,,,FALSE
12/18/2022,TRUE,TRUE,#NAME?,publicar,#NAME?,#NAME?,American Society of Mammalogists — Research in Latin America,Fellowships scholarships or trainings,Agricultural and Biological Sciences,,,,,,,http://www.mammalsociety.org/committees/latin-american-fellowship/#tab6,La American Society of Mammalogists (ASM) ofrece el premio Latin American Student Field Research para proyectos de campo de estudiantes de posgrado latinoamericanos.,,,,,,,,,,,,,USD,1500,5000,,,,01-mar-23,,,,#NAME?,,,,FALSE
12/18/2022,TRUE,TRUE,#NAME?,publicar,#NAME?,#NAME?,Latin America Regional Fund for Agricultural Technologies — Call for Proposals 2023,Research and publications,Agricultural and Biological Sciences,Sustainable Development,,,,,,https://www.fontagro.org/type/convocatoria-2023/,"El Fondo Regional de Tecnología Agropecuaria para América Latina (FONTAGRO) convoca innovaciones para el aumento sostenible de la productividad agrícola en América Latina y el Caribe en el contexto del cambio climático. Los países miembros de FONTAGRO son Argentina, Bolivia, Chile, Colombia, Costa Rica, Ecuador, España, Honduras, Nicaragua, Panamá, Paraguay, Perú, República Dominicana, Uruguay y Venezuela. Se aceptan propuestas de consorcios multinacionales de organizaciones públicas y privadas a nivel nacional, regional e internacional.",,,,,,,,,,,,,USD,,,200,,,03-Apr-23,,,,#NAME?,,,,FALSE
12/18/2022,TRUE,TRUE,#NAME?,publicar,#NAME?,#NAME?,Fondation SUEZ — Access to Water and Sanitation,Prizes and Awards,Sustainable Development,,,,,,,https://www.fondation-suez.com/en/,"La Fondation SUEZ apoya el acceso de las poblaciones desfavorecidas de los países en desarrollo a servicios esenciales como el agua, el saneamiento y los residuos. Uno de los premios se otorga a una innovación no registrada y libre de derechos de autor desarrollada por una organización sin ánimo de lucro. El otro reconoce e incentiva una iniciativa liderada por un emprendedor social. ",,,,,,,,,,,,,EUROS,,,50,,,30-Apr-23,,,,#NAME?,,,,FALSE
12/18/2022,TRUE,TRUE,#NAME?,publicar,#NAME?,#NAME?,Flemish Inter-University Council — Short-Term Projects,Contract tender or cooperative agreement,Sustainable Development,,,,,,,https://www.vliruos.be/en/ongoing_calls/open_calls/call_short_initiatives_(si)_2023/3127,"El Consejo Interuniversitario de Flandes (VLIR-UOS) invita a presentar candidaturas para proyectos de iniciativas breves que tengan como objetivo crear y profundizar colaboraciones académicas/científicas entre diversos equipos de académicos e investigadores. Las Iniciativas Cortas se centran en un reto de desarrollo sostenible. El objetivo es fortalecer las capacidades de investigación y educación de las instituciones de educación superior y científicas en los países socios de América Latina, África y el Sudeste Asiático. ",,,,,,,,,,,,,EUROS,,,70,,,16-mar-23,,,,#NAME?,,,,FALSE
12/18/2022,TRUE,TRUE,#NAME?,publicar,#NAME?,#NAME?,U.S. National Science Foundation — International Research Experiences for U.S. University Students 2023,Fellowships scholarships or trainings,Environmental sciences,,,,,,,https://beta.nsf.gov/funding/opportunities/international-research-experiences-students-ires-0,"A través del programa IRES, la Fundación Nacional de la Ciencia apoya a estudiantes universitarios estadounidenses (de grado y postgrado) para que participen en investigaciones internacionales. Entre las becas concedidas en el pasado se incluyen varias en países en desarrollo en áreas temáticas como la ecología, las energías renovables y el cambio climático, entre otras.",,,,,,,,,,,,,,,,,,,19-Sep-23,,,,#NAME?,,,,FALSE
12/18/2022,TRUE,TRUE,#NAME?,publicar,#NAME?,#NAME?,Global Innovation Fund — Social Innovations for the Developing World,Programs and projects,Agricultural and Biological Sciences,Environmental sciences,Sustainable Development,,,,,https://www.globalinnovation.fund/apply/application-process/,"El Fondo Mundial para la Innovación (GIF) acepta propuestas de soluciones innovadoras y rentables que aborden cualquier reto importante para el desarrollo (incluidos la energía, el acceso al agua, la agricultura y la pesca) en cualquier país o en varios países del mundo en desarrollo. ",,,,,,,,,,,,,USD,230000,15000000,,,periodic,15-feb-23,,,,#NAME?,,,,FALSE
12/18/2022,TRUE,TRUE,#NAME?,publicar,#NAME?,#NAME?,IntelliDigest — Global AgriFood TechPreneur,Prizes and Awards,Agricultural and Biological Sciences,Medicine and Health Sciences,,,,,,https://intellidigest.com/services/food-system-sustainability/agrifood-techpreneur-club/,"El Programa Global AgriFood TechPreneur es un programa de desarrollo empresarial de sostenibilidad del sistema alimentario de 12 meses de duración para jóvenes licenciados que deseen transformar el sistema alimentario y acabar con el hambre, la malnutrición, la obesidad y el desperdicio de alimentos. Se invita a los graduados a presentar una solicitud sobre un reto del sistema alimentario en su país y su solución para abordarlo. Los participantes seleccionados recibirán formación para desarrollar un plan de negocio sólido y sostenible. ",,,,,,,,,,,,,,,,,,,20-feb-23,,,,#NAME?,,,,FALSE
12/18/2022,TRUE,TRUE,#NAME?,publicar,#NAME?,#NAME?,Kubota Fund announces 2023-2024 Grant Program,Fellowships scholarships or trainings,ALL AREA OF INTEREST,,,,,,,https://www.kubota-fund.org/,"El Fondo Kubota ha anunciado el Programa de Subvenciones 2023-2024 para analistas de investigación, becarios y estudiantes de países en desarrollo que se incorporen a programas académicos, educativos o de formación impartidos por instituciones de investigación/educación o empresas privadas situadas en Japón.",,,,,,,,,,,,,USD,,,1,,,17-Jan-23,,,,#NAME?,,,,FALSE
12/18/2022,TRUE,TRUE,#NAME?,publicar,#NAME?,#NAME?,ADVANCED ACADEMIA Fellowships for International Scholars,Fellowships scholarships or trainings,Human and Social Sciences,,,,,,,https://cas.bg/en/2023-2024-call-for-applications-advanced-academia-fellowships-for-international-scholars/,El Centro de Estudios Avanzados de Sofía (CAS Sofía) anuncia una convocatoria de candidaturas para sus becas In-Residence Advanced Academia Fellowships 2023/2024 para investigación fundamental en los campos de las humanidades y las ciencias sociales.,,,,,,,,,,,,,USD,,,1,,,31-mar-23,,,,#NAME?,,,,FALSE
12/18/2022,TRUE,TRUE,#NAME?,publicar,#NAME?,#NAME?,Social Relevance of the Humanities,Fellowships scholarships or trainings,Human and Social Sciences,,,,,,,https://cas.bg/en/2023-2024-call-for-applications-social-relevance-of-the-humanities/,"El programa de becas ""Relevancia social de las humanidades"" (RevHum), propuesto conjuntamente por el Centro de Estudios Avanzados de Sofía y el New Europe College de Bucarest y desarrollado con el apoyo financiero de la Fundación Porticus, pretende subrayar las funciones cognitivas de las humanidades y su potencial como disciplinas críticas abriéndolas a cuestiones relevantes en/para el mundo digital contemporáneo, cuestiones que son ""prácticas"", pero también epistemológicas, éticas, filosóficas, etc.",,,,,,,,,,,,,USD,,,1,,,31-mar-23,,,,#NAME?,,,,FALSE
12/18/2022,TRUE,TRUE,#NAME?,publicar,#NAME?,#NAME?,The Liveability Challenge,Prizes and Awards,Agricultural and Biological Sciences,Environmental sciences,,,,,,https://www.theliveabilitychallenge.org/,"El Desafío Liveability busca innovaciones disruptivas que puedan establecer un sistema circular de agricultura urbana o acuicultura, o un sistema alternativo de proteínas. Buscan soluciones tecnológicas innovadoras y rompedoras para maximizar la eficiencia de la producción y minimizar las necesidades de recursos",,,,,,,,,,,,,USD,500000,1000000,,,,31-mar-23,,,,#NAME?,,,,FALSE
12/18/2022,TRUE,TRUE,#NAME?,publicar,#NAME?,#NAME?,Advocates of Climate Change Mitigation,Programs and projects,Environmental sciences,,,,,,,https://unifor.no/stiftelser/the-minor-foundation-for-major-challenges/?_sf_s=Minor,La Fundación Minor para Grandes Retos (MFMC) ofrece subvenciones para apoyar a los defensores de la mitigación del cambio climático.,,,,,,,,,,,,,USD,100000,500000,,,,10-feb-23,,,,#NAME?,,,,FALSE
12/18/2022,TRUE,TRUE,#NAME?,publicar,#NAME?,#NAME?,Cure Parkinson’s Quarterly Research Grant Funding Programme,Programs and projects,Medicine and Health Sciences,,,,,,,https://cureparkinsons.org.uk/for-researchers/apply-for-funding/quarterly-research-grant-funding/,Cure Parkinson's (CP) da la bienvenida a las solicitudes para su Programa Trimestral de Financiación de Ayudas a la Investigación.,,,,,,,,,,,,,USD,100000,500000,,,,09-Jan-23,,,,#NAME?,,,,FALSE
12/18/2022,TRUE,TRUE,#NAME?,publicar,#NAME?,#NAME?,Culture & Animals Foundation Grant Program,Programs and projects,Agricultural and Biological Sciences,,,,,,,https://cultureandanimals.org/grants/grant-application/,La Culture & Animals Foundation (CAF) busca solicitudes para su Programa de Subvenciones.,,,,,,,,,,,,,USD,,,1,,,31-Jan-23,,,,#NAME?,,,,FALSE
12/18/2022,TRUE,TRUE,#NAME?,publicar,#NAME?,#NAME?,Free Electrons Ultimate Open Innovation Program,Travel and Conferences,Engineering,,,,,,,https://freeelectrons.org/,Applications for the 2023 Free Electrons Ultimate Open Innovation Program are now open.,,,,,,,,,,,,,USD,,,"1,000,000",,,28-Jan-23,,,,#NAME?,,,,FALSE
12/18/2022,TRUE,TRUE,#NAME?,publicar,#NAME?,#NAME?,Kellogg-Morgan Stanley Sustainable Investing Challenge 2022,Prizes and Awards,Sustainable Development,,,,,,,https://www.sustainableinvestingchallenge.org/,Ya están abiertas las candidaturas para el Kellogg-Morgan Stanley Sustainable Investing Challenge 2022 bajo el lema Diseñar una solución financiera creativa para un problema social o medioambiental urgente.,,,,,,,,,,,,,USD,1000,10000,,,,15-Jan-23,,,,#NAME?,,,,FALSE
12/18/2022,TRUE,TRUE,#NAME?,publicar,#NAME?,#NAME?,Front Line Defenders 2023 Award - Human Rights Defenders at Risk,Prizes and Awards,Human and Social Sciences,,,,,,,https://www.frontlinedefenders.org/en/call-nominations-2023-front-line-defenders-award-human-rights-defenders-risk,The Front Line Defenders is currently accepting nominations for the 2023 Front Line Defenders Award for Human Rights Defenders at Risk.,,,,,,,,,,,,,,,,,,,13-Jan-23,,,,#NAME?,,,,FALSE
12/18/2022,TRUE,TRUE,#NAME?,publicar,#NAME?,#NAME?,International Eco-Hero Awards for Young Environmentalists,Prizes and Awards,Environmental sciences,,,,,,,https://actionfornature.org/eco-hero-awards,"¿Has trabajado para preservar el mundo que te rodea? ¿Has enseñado a otros a proteger el medio ambiente? ¿Has realizado algún proyecto de investigación medioambiental? Si tu respuesta a cualquiera de estas preguntas es afirmativa, entonces puedes optar a los Premios Ecohéroe.",,,,,,,,,,,,,USD,,,1,,,28-feb-23,,,,#NAME?,,,,FALSE
12/18/2022,TRUE,TRUE,#NAME?,publicar,#NAME?,#NAME?,Open Call for Satellites for Biodiversity Award,Prizes and Awards,Conservation,,,,,,,https://connectedconservation.foundation/news/satellites-for-biodiversity-award,"¿Usted o su equipo están explorando la teledetección en la vigilancia de la biodiversidad? ¿Está investigando nuevas formas de aprovechar el potencial de una nueva generación de satélites para preservar algunas de las especies más majestuosas? Si la respuesta es afirmativa, presente su candidatura al Premio Satélites para la Biodiversidad.",,,,,,,,,,,,,USD,1000,10000,,,,03-feb-23,,,,#NAME?,,,,FALSE
12/18/2022,TRUE,TRUE,#NAME?,publicar,#NAME?,#NAME?,"European Commission CFPs: Planning, Tracking, and Assessing Scientific Knowledge Production",Programs and projects,ALL AREA OF INTEREST,,,,,,,"https://ec.europa.eu/info/funding-tenders/opportunities/portal/screen/opportunities/topic-details/horizon-infra-2023-eosc-01-03;callCode=null;freeTextSearchKeyword=;matchWholeText=true;typeCodes=1,2;statusCodes=31094502;programmePeriod=null;programCcm2Id=null;programDivisionCode=null;focusAreaCode=null;destinationGroup=null;missionGroup=null;geographicalZonesCode=null;programmeDivisionProspect=null;startDateLte=null;startDateGte=null;crossCuttingPriorityCode=null;cpvCode=null;performanceOfDelivery=null;sortQuery=startDate;orderBy=desc;onlyTenders=false;topicListKey=topicSearchTablePageState","La Comisión Europea (CE) ha lanzado propuestas para la Planificación, Seguimiento y Evaluación de la Producción de Conocimiento Científico.",,,,,,,,,,,,,USD,500000,1000000,,,,09-mar-23,,,,#NAME?,,,,FALSE
12/18/2022,TRUE,TRUE,#NAME?,publicar,#NAME?,#NAME?,"2024 International Conference on Sexual Assault, Domestic Violence, and the Cycle of Justice",Travel and Conferences,Human and Social Sciences,,,,,,,https://evawintl.org/callforabstracts/,"En las propuestas para la conferencia de 2024, EVAW International está buscando estrategias creativas y compasivas que reflejen el Ciclo de la Justicia, entonces solicite ahora la Conferencia Internacional de 2024 sobre Agresión Sexual, Violencia Doméstica y el Ciclo de la Justicia. ¿Cómo pueden mejorarse las respuestas a la agresión sexual, la violencia doméstica, la trata de seres humanos y otras formas de violencia de género, de manera que se desarrollen para los supervivientes, momento a momento, paso a paso, a lo largo del tiempo? ¿Cómo superar los obstáculos, incluido el ciclo de la duda al que se enfrentan tantos supervivientes? Tal vez lo más importante sea cómo mantener el impulso positivo para seguir avanzando. ¡Empieza a trabajar en esas propuestas ahora, para compartir tu punto de vista único sobre el Ciclo de la Justicia!",,,,,,,,,,,,,,,,,,,08-may-23,,,,#NAME?,,,,FALSE
12/18/2022,TRUE,TRUE,#NAME?,publicar,#NAME?,#NAME?,Applications Open for Professionals Grants Program,Programs and projects,Medicine and Health Sciences,,,,,,,https://www.mcgill.ca/gchp/grants/professionals-grants,El Programa Global de Salud Infantil de McGill (GCHP) está aceptando solicitudes para el Programa de Becas Profesionales para profesionales de la salud interesados en la Salud Materno-Infantil (MCH).,,,,,,,,,,,,,,,,,,,15-feb-23,,,,#NAME?,,,,FALSE
3/24/2023,TRUE,TRUE,#NAME?,publicar,#NAME?,#NAME?,Einstein Forum — Einstein Fellowship 2024,Fellowships scholarships or trainings,Agricultural and Biological Sciences,Human and Social Sciences,,,,,,https://www.einsteinforum.de/about/fellowship/?lang=en,"beca a investigadores noveles que deseen llevar a cabo un proyecto en un campo distinto al de su investigación anterior CON título universitario en humanidades, ciencias sociales o ciencias naturales.",,,,,,,,,,,,,EUROS,,,10,,,15-may-23,,,,#NAME?,,,,FALSE
3/24/2023,TRUE,TRUE,#NAME?,publicar,#NAME?,#NAME?,Mohamed bin Zayed Species Conservation Fund — Grants in Support of Endangered and Critically Endangered Species,Programs and projects,Conservation,,,,,,,https://www.speciesconservation.org/grants/,"subvenciones a particulares, comunidades y organizaciones para la conservación de especies animales, vegetales y fúngicas amenazadas o poco conocidas en todo el mundo. ",,,,,,,,,,,,,USD,,,25,,,31-oct-23,,,,#NAME?,,,,FALSE
3/24/2023,TRUE,TRUE,#NAME?,publicar,#NAME?,#NAME?,Turtle Conservation Fund — Research and Conservation of Tortoises and Freshwater Turtles,Programs and projects,Conservation,,,,,,,https://smithht.org/grant-seekers,conservación e investigación de tortugas terrestres y galápagos en peligro o en peligro crítico.,,,,,,,,,,,,,USD,1000,5000,,,semiannual,01-jun-23,01-Dec-23,,,#NAME?,,,,FALSE
3/24/2023,TRUE,TRUE,#NAME?,publicar,#NAME?,#NAME?,Stanley Smith Horticultural Trust — Grants for Research and Training 2023,Programs and projects,Agricultural and Biological Sciences,Education,,,,,,https://smithht.org/grant-seekers,"subvenciones para la educación y la investigación en horticultura ornamental, principalmente en Norteamérica, Sudamérica, Centroamérica, el Caribe y Australia. Los proyectos pueden centrarse en la investigación en horticultura ornamental, la creación y el mantenimiento de jardines accesibles al público con fines educativos, actividades educativas que fomenten la horticultura ornamental y el cultivo ambientalmente responsable de plantas con valor hortícola ornamental. ",,,,,,,,,,,,,USD,,,25,,,15-jun-23,,,,#NAME?,,,,FALSE
3/24/2023,TRUE,TRUE,#NAME?,publicar,#NAME?,#NAME?,Association of Field Ornithologists — Grants for Research on Neotropical Birds,Programs and projects,Conservation,,,,,,,https://afonet.org/grants-awards/skutch-award/,estudio científico y a la divulgación de información sobre las aves en sus hábitats naturales.,,,,,,,,,,,,,USD,,,10,,,15 July 2022.,,,,#NAME?,,,,FALSE
3/24/2023,TRUE,TRUE,#NAME?,publicar,#NAME?,#NAME?,Club300 Foundation — Grants for Bird Protection,Programs and projects,Conservation,,,,,,,https://www.club300.se/club300/bird-protection/,El objetivo es la investigación y conservación de las especies de aves más amenazadas y menos conocidas del mundo (Lista Roja de la UICN).,,,,,,,,,,,,,USD,,,5,,yearly,31-jul-23,,,,#NAME?,,,,FALSE
3/24/2023,TRUE,TRUE,#NAME?,publicar,#NAME?,#NAME?,People’s Trust for Endangered Species — Conservation Insight Grants,Programs and projects,Conservation,,,,,,,https://ptes.org/grants/apply-grant/worldwide-grant-criteria/,"subvenciones a investigadores científicos y conservacionistas de todo el mundo para trabajos que ayuden a preservar especies amenazadas, ya sea mediante investigación o trabajo de campo aplicado. ",,,,,,,,,,,,,LIBRAS,3000,10000,,,,06 de agosto de 2023,,,,#NAME?,,,,FALSE
3/24/2023,TRUE,TRUE,#NAME?,,#NAME?,#NAME?,Blue Marine Foundation — Ocean Awards,Prizes and Awards,Environmental sciences,Conservation,Sustainable Development,,,,,https://www.bluemarinefoundation.com/projects/the-ocean-awards/,"contribuciones significativas a la salud del medio marino, a la gestión sostenible de los recursos marinos o al compromiso público con los océanos y los mares",,,,,,,,,,,,,,,,,,periodic,,,,,#NAME?,,,,FALSE
3/24/2023,TRUE,TRUE,#NAME?,publicar,#NAME?,#NAME?,World Food Prize Foundation — World Food Prize 2023,Prizes and Awards,Agricultural and Biological Sciences,Environmental sciences,Sustainable Development,,,,,https://www.worldfoodprize.org/en/nominations/the_world_food_prize/the_world_food_prize_nomination/,recompensa a una o varias personas que hayan contribuido de forma destacada a mejorar la producción mundial de alimentos y su distribución entre los más necesitados. Entre los campos en los que se pueden conseguir logros se incluyen el suelo y la tierra; la ciencia de las plantas y los animales; la ciencia y la tecnología de los alimentos; el desarrollo rural; el agua y el medio ambiente; la conservación de los recursos naturales; la eliminación de la pobreza; y muchos otros,,,,,,,,,,,,,USD,,,250,,,1 de mayo de 2023.,,,,#NAME?,,,,FALSE
3/24/2023,TRUE,TRUE,#NAME?,publicar,#NAME?,#NAME?,Call for Applications: UNICEF Impact Catalyst Fund,Programs and projects,Human and Social Sciences,Sustainable Development,,,,,,https://www.unicef.org/evaluation/unicef-evaluation-impact,"UNICEF está aceptando solicitudes para su Fondo Catalizador de Impacto (ICF), una iniciativa estratégica de la Oficina de Evaluación de UNICEF que tiene como objetivo apoyar evaluaciones de impacto de alta calidad en áreas temáticas prioritarias del Plan Estratégico de UNICEF 2022-2025.",,,,,,,,,,,,,USD,100000,500000,,,,30-Apr-23,,,,#NAME?,,,,FALSE
3/24/2023,TRUE,TRUE,#NAME?,publicar,#NAME?,#NAME?,"Up to $50,000 available under Abie Award",Prizes and Awards,Engineering,,,,,,,https://anitab.org/awards-grants/abie-awards/,celebrar y destacar el éxito de las tecnólogas mujeres y no binarias y de quienes las apoyan en la tecnología.,,,,,,,,,,,,,USD,10000,100000,,,,26-Apr-23,,,,#NAME?,,,,FALSE
3/24/2023,TRUE,TRUE,#NAME?,publicar,#NAME?,#NAME?,Call for Applications: UNESCO Creative Cities Network 2023,Programs and projects,Sustainable Development,,,,,,,https://en.unesco.org/creative-cities/content/2023-call-applications,"cooperación con y entre las ciudades que han reconocido la creatividad como factor estratégico de desarrollo sostenible en los aspectos económico, social, cultural y medioambiental.",,,,,,,,,,,,,,,,,,,30-jun-23,,,,#NAME?,,,,FALSE
