5/29/2020,FALSE,FALSE,#NAME?,,#NAME?,#NAME?,Species Recovery,,,,,,,,,https://www.nationalgeographic.org/funding-opportunities/grants/what-we-fund/species-recovery/,"The National Geographic Society seeks proposals that â€œstimulate, promote and support conservation actions for halting biodiversity decline, preventing speciesâ€™ extinctions, and restoring and conserving intact habitats and ecosystems, both on the ground and in the waterâ€_x009d_. In partnership with the IUCN SSC, the goal is to halt further biodiversity decline by implementing species conservation plans. Funds are not restricted by taxon or region, but proposals must include principal investigators or participants resident in the country where the fieldwork will be conducted. Typical proposal requests should be less than $30 thousand, but applicants may request up to $50 thousand. The deadline for applications is October 2020.",,,USA,National Geographic Society,,,,,,,,,,,,,,,31-oct-20,,,,#NAME?,,,,FALSE
6/16/2020,FALSE,TRUE,#NAME?,,#NAME?,#NAME?,The Satinder Ahuja Award for Young Investigators in Separation Science,Prizes and Awards,Chemical and Bio Engineering,,,,,,,https://www.mendeley.com/research-funding/opportunities/300074131,,,,,American Chemical Society,,,,Early Career and New Faculty Researchers,,,,,,"Up to 25,000 USD",,,,,31-oct-20,,,,#NAME?,,,,FALSE
03-02-21,FALSE,FALSE,#NAME?,,#NAME?,#NAME?,Threatened Invertebrates,Research and publications,Agricultural and Biological Sciences,Conservation,"Zoology, Ecology and Behavior",,,,,https://www.wildplanettrust.org.uk/about-us/grants/,"The Wild Planet Trust awards grants to individuals undertaking nature conservation projects. Projects may involve practical habitat or species management, research, training, education, awareness raising or campaigning. The Trust seeks conservation projects with focus on threatened invertebrates. Wild Planet Trust awards grants to both UK and overseas projects. Awards typically range from Â£500 to Â£1,500. The application deadline is 31 October 2020.",,,UK,Wild Planet Trust,,,,,,,,,,,,,,currently suspended,31-oct-20,,,,#NAME?,,,,FALSE
10-07-21,TRUE,TRUE,#NAME?,,#NAME?,#NAME?,Whitley Fund for Nature -- Whitley Awards 2022,Prizes and Awards,Conservation,,,,,,,https://whitleyaward.org/apply-for-conservation-funding/how-to-apply/,destacados líderes en conservación de la biodiversidad en países en desarrollo de todo el mundo.,proyectos que conservan humedales y agua dulce; ecosistemas costeros y marinos; y biodiversidad terrestre.,,,,,,,,,,,,libras esterlinas,400000,,,,,31-oct-20,,,,#NAME?,,,,FALSE
10-07-21,TRUE,TRUE,#NAME?,,#NAME?,#NAME?,Postdoctoral Fellowship in Biodiversity Genomics,Fellowships scholarships or trainings,Biochemistry Genetics and Molecular Biology,,,,,,,https://fellowships.si.edu/BioG,"propuestas de investigación colaborativa en Genómica de la Biodiversidad, involucrando enfoques genómicos comparativos como filogenómica, genómica de poblaciones, metagenómica o transcriptómica y análisis bioinformático. ",,,,,,,,,,,,,us,55000,,,,,01-nov-20,,,,#NAME?,,,,FALSE
6/14/2020,FALSE,TRUE,#NAME?,,#NAME?,#NAME?,Smithsonian Institution fellowships,Fellowships scholarships or trainings,Miscellaneous,,,,,,,https://stri.si.edu/academic-programs/fellowships,"The Smithsonian Institution’s central fellowship program awards scholarships to conduct independent study at one or more of the Smithsonian’s 19 units and research centers. Fellowships are designed for young scholars at different stages of their academic career from graduate students to senior postdoctoral researchers. Please follow the links below for information about duration, eligibility and stipends related to specific SI fellowships.

There are numerous Smithsonian Institution fellowships that can be hosted at STRI, ranging from 10 weeks to three years, depending on the fellowship. These academic appointments are targeted to a range of young scholars from graduate students to senior post-doctoral researchers. All applicants for fellowships are eligible and considered for the Secretary’s Distinguished Research Fellowship, which provides the awardee with an additional year of support. ","Diciplines explicited are: Animal behavior, ecology, and environmental science, including an emphasis on the tropics. Anthropology, including archaeology, cultural anthropology, linguistics, and physical anthropology. Astrophysics and astronomy. Earth sciences and paleobiology. Evolutionary & systematic biology. Folklife. History of science and technology. History of art, especially American, contemporary, African, and Asian art, twentieth-century American crafts, and decorative arts. Materials research. Molecular biology. Social and cultural history of the United States.",,USA,Smithsonian Institution,,,,Individuals,Posdocs,Graduate students,Undergrads,,,,,,,yearly,01-nov-20,,,,#NAME?,,,,FALSE
10-07-21,TRUE,TRUE,#NAME?,,#NAME?,#NAME?,Composting Council Research and Education Foundation -- Poster Contest,Prizes and Awards,Agricultural and Biological Sciences,,,,,,,https://www.compostfoundation.org/ICAW/ICAW-Poster-Contest,"""Receta para la regeneración: abono"". El póster ganador servirá como pieza promocional de la Semana Internacional de Concientización sobre el Compost 2022",,,,,,,,,,,,,us,500,,,,,01-nov-20,,,,#NAME?,,,,FALSE
10-07-21,TRUE,TRUE,#NAME?,,#NAME?,#NAME?,Smithsonian Institution -- Fellowship Program 2022,Fellowships scholarships or trainings,all areas of interest,,,,,,,https://fellowships.si.edu/smithsonian-institution-fellowship-program-sifp,becas para estudios o investigaciones independientes,,,,,,,,,,,,,us,,8000,55,,,01-nov-20,,,,#NAME?,,,,FALSE
08-10-21,TRUE,TRUE,#NAME?,,#NAME?,#NAME?,UK Foreign and Commonwealth Office — Chevening Scholarships 2022-2023,Fellowships scholarships or trainings,Agricultural and Biological Sciences,Conservation,Environmental sciences,,,,,https://www.chevening.org/scholarships/guidance/,"proporcionan financiación total o parcial para cursos de tiempo completo a nivel de posgrado, normalmente una maestría de un año, en cualquier materia en cualquier universidad del Reino Unido. ",,,,,,,,,,,,,USD,,,,,,02-nov-20,,,,#NAME?,,,,FALSE
10-07-21,TRUE,TRUE,#NAME?,,#NAME?,#NAME?,Programa de subvenciones de la Ley de conservación de aves migratorias neotropicales del año fiscal 22,Programs and projects,Conservation,Agricultural and Biological Sciences,,,,,,https://www.grants.gov/web/grants/view-opportunity.html?oppId=335447,"Programa de Subvenciones de la Ley de Conservación de Aves Migratorias Neotropicales del año fiscal 22 para apoyar proyectos que promuevan la conservación de aves migratorias neotropicales y sus hábitats en los Estados Unidos , Canadá , América Latina y el Caribe .",,,,,,,,,,,,,usd,,100000,200,,,04-nov-20,,,,#NAME?,,,,FALSE
10-07-21,TRUE,TRUE,#NAME?,,#NAME?,#NAME?,U.S. Fish and Wildlife Service -- Conservation of Neotropical Migratory Birds 2022,Programs and projects,Conservation,Environmental sciences,,,,,,https://terravivagrants.org/conservation-of-neotropical-migratory-birds/,"subvenciones competitivas para apoyar la conservación de aves migratorias neotropicales y sus hábitats en EE. UU., Canadá, América Latina y el Caribe.",,,,,,,,,,,,,,,,,,,04-nov-20,,,,#NAME?,,,,FALSE
10-07-21,TRUE,TRUE,#NAME?,,#NAME?,#NAME?,Volkswagen Stiftung — Preventing Pandemics,Programs and projects,Medicine and Health Sciences,,,,,,,https://www.volkswagenstiftung.de/en/funding/our-funding-portfolio-at-a-glance/global-issues-preventing-pandemics-the-role-of-human-environmental-interactions,"Prevención de pandemias: el papel de las interacciones entre humanos y medio ambiente. mejor comprensión de la aparición y propagación de enfermedades transmisibles como las zoonosis, una comprensión más profunda de la complejidad y dinámica de las interacciones humano-ambientales y las conexiones entre la salud humana, animal y ambiental. ",,,,,,,,,,,,,euros,1 .5 million,,,,,04-nov-20,,,,#NAME?,,,,FALSE
10-07-21,TRUE,TRUE,#NAME?,,#NAME?,#NAME?,Japan Science and Technology Agency — Research Partnership 2022,Programs and projects,Sustainable Development,,,,,,,https://www.jst.go.jp/global/english/koubo.html,propuestas para la Asociación de Investigación Científica y Tecnológica para el Desarrollo Sostenible (SATREPS) en los siguientes campos de investigación: medio ambiente / energía; bio-recursos; y prevención y mitigación de desastres.,,,,,,,,,,,,,yen,100000,,,,,08-nov-20,,,,#NAME?,,,,FALSE
10-07-21,TRUE,TRUE,#NAME?,,#NAME?,#NAME?,Apply for Wellcome Discovery Awards,Prizes and Awards,Medicine and Health Sciences,,,,,,,https://wellcome.org/grant-funding/schemes/discovery-awards,"cualquier disciplina que quieran perseguir ideas de investigación audaces y creativas para generar cambios significativos en la comprensión que podrían mejorar la vida, la salud y el bienestar de las personas.",,,,,,,,,,,,,usd,"$100,000 ","$500,000 ",,,,11-nov-20,,,,#NAME?,,,,FALSE
11/25/2020,FALSE,FALSE,#NAME?,,#NAME?,#NAME?,Environmental & Exercise Physiology Section CANTROL Environmental Systems Postdoctoral Research Award,Research and publications,Environmental sciences,,,,,,,https://www.mendeley.com/research-funding/opportunities/300064679,,,,,American Physiological Society,,,,Mid-Career and Experienced Researchers,,,,,,"Up to 1,000 USD",,,,,13-nov-20,,,,#NAME?,,,,FALSE
6/16/2020,FALSE,TRUE,#NAME?,,#NAME?,#NAME?,Environmental & Exercise Physiology Section New Investigator Award,Prizes and Awards,Biochemistry Genetics and Molecular Biology,,,,,,,https://www.mendeley.com/research-funding/opportunities/300121275,,,,,American Physiological Society,,,,Early Career and New Faculty Researchers,,,Mid-Career and Experienced Researchers,,,"Up to 1,000 USD",,,,,13-nov-20,,,,#NAME?,,,,FALSE
11/25/2020,FALSE,FALSE,#NAME?,,#NAME?,#NAME?,Environmental & Exercise Physiology Section Partnership for Clean Competition Anti-doping Predoctoral Research Award,Fellowships scholarships or trainings,Environmental sciences,,,,,,,https://www.mendeley.com/research-funding/opportunities/300122123,,,,,American Physiological Society,,,,Graduate Students,,,,,,"Up to 2,000 USD",,,,,13-nov-20,,,,#NAME?,,,,FALSE
11/25/2020,FALSE,FALSE,#NAME?,,#NAME?,#NAME?,The Usha (“dawn”_x009d_ in Sanskrit) Award,Prizes and Awards,Biochemistry Genetics and Molecular Biology,,,,,,,https://www.mendeley.com/research-funding/opportunities/300064479,,,,,American Physiological Society,,,,Graduate Students,,,Mid-Career and Experienced Researchers,,,Up to 500 USD,,,,,13-nov-20,,,,#NAME?,,,,FALSE
11/25/2020,FALSE,FALSE,#NAME?,,#NAME?,#NAME?,Ecological Knowledge Research Fellowship,Research and publications,Environmental sciences,,,,,,,https://www.mendeley.com/research-funding/opportunities/300111849,,,,,Society of Ethnobiology,,,,Graduate Students,,,,,,Up to 750 USD,,,,,14-nov-20,,,,#NAME?,,,,FALSE
11/25/2020,FALSE,FALSE,#NAME?,,#NAME?,#NAME?,Giles F. Filley Memorial Award for Excellence in Respiratory Physiology and Medicine,Prizes and Awards,Biochemistry Genetics and Molecular Biology,,,,,,,https://www.mendeley.com/research-funding/opportunities/300020567,,,,,American Physiological Society,,,,Mid-Career and Experienced Researchers,,,,,,"Up to 16,000 USD",,,,,14-nov-20,,,,#NAME?,,,,FALSE
08-02-22,TRUE,TRUE,#NAME?,,#NAME?,#NAME?,International Terre des Femmes Award,Prizes and Awards,Conservation,,,,,,,https://www.yves-rocher-fondation.org/en/how-to-apply-for-the-international-award/,"onrar a las mujeres por sus logros en la concienciación ambiental, la conservación y la solidaridad. ",,,,,,,,,,,,,euros,10000,,,,,15-nov-20,,,,#NAME?,,,,FALSE
08-10-21,TRUE,TRUE,#NAME?,,#NAME?,#NAME?,American Association for the Advancement of University Women — International Fellowships 2022,Fellowships scholarships or trainings,All Areas of scienses,,,,,,,https://www.aauw.org/resources/programs/fellowships-grants/current-opportunities/international/,apoyo a las mujeres que cursan estudios de posgrado o posdoctorado a tiempo completo en los EE. UU.,,,,,,,,,,,,,USD,,18000,30000,,,15-nov-20,,,,#NAME?,,,,FALSE
08-01-22,TRUE,TRUE,#NAME?,,#NAME?,#NAME?,Premio Energy Globe a la sostenibilidad,Prizes and Awards,Sustainable Development,,,,,,,https://www.energyglobe.info/participate,La convocatoria de nominaciones para el premio Energy Globe Award for Sustainability 2022 ya está abierta con el objetivo de presentar proyectos sostenibles exitosos a una audiencia global y demostrar que para la mayoría de nuestros problemas ambientales ya existen soluciones viables.,"La participación está abierta a todos los proyectos que salvan nuestro medio ambiente como la conservación de recursos, la mejora de la calidad del aire y del agua , la eficiencia energética y las energías renovables y áreas relacionadas. También serán elegibles para participar proyectos que se enfoquen en la creación de conciencia en estas áreas.",,,,,,,,,,,,euros,,2000,,,,15-nov-20,,,,#NAME?,,,,FALSE
8/13/2021,TRUE,TRUE,#NAME?,,#NAME?,#NAME?,Presentar solicitudes para becas internacionales,Fellowships scholarships or trainings,All Areas of scienses,,,,,,,https://www.aauw.org/resources/programs/fellowships-grants/current-opportunities/international//,"La Asociación Estadounidense de Mujeres Universitarias (AAUW) está buscando solicitudes para las Becas Internacionales para apoyar a las mujeres que realizan estudios de posgrado o posdoctorado a tiempo completo en los Estados Unidos para mujeres que no son ciudadanas de los EE. UU. O residentes permanentes, y que tienen la intención de regresar a sus país de origen para seguir una carrera profesional.",,,,,,,,,,,,,usd,,18000,30000,,,15-nov-20,,,,#NAME?,,,,FALSE
10-07-21,TRUE,TRUE,#NAME?,,#NAME?,#NAME?,Terre de Femmes International Award,Prizes and Awards,Environmental sciences,,,,,,,https://www.yves-rocher-fondation.org/en/how-to-apply-for-the-international-award/,La Fundación Yves Rocher ha lanzado su Premio Internacional Terre de Femmes para premiar a las mujeres ciudadanas de este hermoso planeta que están trabajando para preservarlo.,,,,,,,,,,,,,usd,,10000,100,,,15-nov-20,,,,#NAME?,,,,FALSE
10-07-21,TRUE,TRUE,#NAME?,,#NAME?,#NAME?,Wildlife Acoustics Scientific Product Grant Program,Programs and projects,Conservation,Agricultural and Biological Sciences,,,,,,https://www.wildlifeacoustics.com/grant-program,"apoyar el avance de la investigación en biología animal, el monitoreo del hábitat y la conservación ambiental que proporciona a los científicos recursos para ayudar a avanzar en su investigación sobre el estudio de murciélagos, aves, ranas y otros animales vocales. fauna silvestre.",,,,,,,,,,,,,usd,,1000,10,,,15-nov-20,,,,#NAME?,,,,FALSE
10-07-21,TRUE,TRUE,#NAME?,,#NAME?,#NAME?,Wellcome Career Development Awards,Prizes and Awards,all areas of interest,,,,,,,https://wellcome.org/grant-funding/schemes/career-development-awards,financiamiento a investigadores de carrera intermedia de cualquier disciplina que tengan el potencial de ser líderes de investigación internacionales.,,,,,,,,,,,,,usd,100000,500000,,,,16-nov-20,,,,#NAME?,,,,FALSE
5/29/2020,FALSE,FALSE,#NAME?,,#NAME?,#NAME?,CLP - Future connservationist award,Prizes and Awards,,,,,,,,https://terravivagrants.org/links-and-resources/agriculture-energy-environment-and-natural-resources/,"Mejorar la comprensión de los peligros para los seres humanos y los ecosistemas relacionados con el cambio climático en los entornos costeros y oceánicos, así como la respuesta a los mismos.",,,,Conservation Leadership programme,worldwide,,,,,,,,,,,,15000,yearly,24-nov-20,,,,#NAME?,,,"Teams are supported to undertake small-scale research and awareness-raising projects. In the 2019 funding round the Future Conservationist Awards will be granted to teams of early-careers conservationists to conduct projects on target species that are listed as Data Deficient, Vulnerable, Endangered or Critically Endangered on the IUCN Red List.",FALSE
12/13/2020,TRUE,TRUE,#NAME?,,#NAME?,#NAME?,The New Zealand Embassy Fund for Argentina and Paraguay: Call for Proposals 2020-2021,Programs and projects,Human and Social Sciences,"Climate change and resilience
","Transparency and citizen participation
","Gender equality
",Social and/or health issues related to COVID-19 pandemic,,,https://raci.org.ar/the-new-zealand-embassy-fund-for-argentina-and-paraguay-call-for-proposals-2020-2021/?lang=en,"The Fund supports community projects in small scale that contribute to increase the wellbeing of a community in the short term. The projects must be in line with the mission of the New Zealand Embassy Fund, which seeks “sustainable development in developing countries, in order to reduce poverty and contribute to a more secure, equitable, and prosperous world.”","Projects with gender perspective, that can generate a major impact in the promotion of human rights and the environment will be specially considered",Funding will not be provided to individuals,NZ,"Argentine Network for International Cooperation (RACI, for its Spanish acronym)",Argentina y Paraguay,,,non-governmental organizations,non-profit community groups,,,,,Up to 25.000 NZ,,,,yearly,24-nov-20,,,,#NAME?,,,,FALSE
03-02-21,FALSE,FALSE,#NAME?,,#NAME?,#NAME?,Community Self-Reliance Activity,Research and publications,Environmental sciences,,,,,,,https://www.mendeley.com/research-funding/opportunities/300123942,,,,,United States Agency for International Development,,,,Commercial Organizations,,,Non-profit Organizations,,,"Up to 2,000,000 USD",,,,,29-nov-20,,,,#NAME?,,,,FALSE
11/26/2020,FALSE,FALSE,#NAME?,,#NAME?,#NAME?,NZ Horticultural Science Advancement Trust Award,Prizes and Awards,Agricultural and Biological Sciences,,,,,,,https://www.mendeley.com/research-funding/opportunities/300111747,,,,,New Zealand Institute of Agricultural and Horticultural Science,,,,,,,,,,"Up to 3,000 USD",,,,,29-nov-20,,,,#NAME?,,,,FALSE
11/26/2020,FALSE,FALSE,#NAME?,,#NAME?,#NAME?,Water for Life – Existing regional water systems,Programs and projects,Environmental sciences,,,,,,,https://www.mendeley.com/research-funding/opportunities/300107803,,,,,Government of Alberta,,,,,,,,,,Not specified,,,,,29-nov-20,,,,#NAME?,,,,FALSE
4/13/2021,TRUE,TRUE,#NAME?,,#NAME?,#NAME?,2022 Ya están abiertas las nominaciones para el Stockholm Water Prize,Artistic pursuit,Conservation,,,,,,,https://www.siwi.org/prizes/stockholmwaterprize/nominate/,"Puede ser nominada cualquier mujer, hombre u organización que haya realizado contribuciones destacadas a la conservación y protección de los recursos hídricos del mundo y a la mejora de la salud de los habitantes y ecosistemas del planeta. Los logros pueden estar dentro de los campos de la ciencia, la tecnología, la educación, las políticas públicas o la práctica relacionada con el uso sostenible y la protección de los recursos hídricos del mundo. El trabajo del candidato debe tener un impacto probado y / o un gran potencial.","Esto reconoce a mujeres , hombres y organizaciones que han hecho contribuciones sobresalientes al uso sostenible y la protección de los recursos hídricos del mundo.",,,,,,,,,,,,,0,,,,,30-nov-20,,,,#NAME?,,,,FALSE
11/26/2020,FALSE,FALSE,#NAME?,,#NAME?,#NAME?,Bill Terrell Graduate Research Grant,Research and publications,Environmental sciences,,,,,,,https://www.mendeley.com/research-funding/opportunities/300107835,,,,,Georgia Ornithological Society,,,,Graduate Students,,,,,,"Up to 15,000 USD",,,,,30-nov-20,,,,#NAME?,,,,FALSE
6/16/2020,FALSE,TRUE,#NAME?,,#NAME?,#NAME?,Charles River Laboratory Linda Hazel Memorial Award,Prizes and Awards,Chemical and Bio Engineering,,,,,,,https://www.mendeley.com/research-funding/opportunities/300106448,,,,,American Association for Laboratory Animal Science,,,,,,,,,,Up to 200 USD,,,,,30-nov-20,,,,#NAME?,,,,FALSE
08-10-21,TRUE,TRUE,#NAME?,,#NAME?,#NAME?,Comisión Europea: Adaptación al cambio climático,Programs and projects,Environmental sciences,,,,,,,https://bit.ly/2UUfrQD,ayudar a lograr la visión a largo plazo de la nueva Estrategia sobre Adaptación al Cambio Climático,,,,,,,,,,,,,euros,,,30.500.000 EUR,,,30-nov-20,,,,#NAME?,,,,FALSE
8/18/2021,TRUE,TRUE,#NAME?,,#NAME?,#NAME?,Convocatoria de propuestas para la gobernanza ambiental,Programs and projects,Environmental sciences,,,,,,,https://bit.ly/3kp1xkb,"facilitar la transición hacia una economía sostenible, circular, libre de tóxicos, energéticamente eficiente / resistente al clima y hacia un medio ambiente libre de tóxicos, así como proteger, restaurar y mejorar la calidad del medio ambiente.",,,,,,"organismos públicos (entidades establecidas como organismos públicos de conformidad con la legislación nacional, incluidas las autoridades locales, regionales o nacionales) u organizaciones internacionales",,,,,,,usd,,,,,,30-nov-20,,,,#NAME?,,,,FALSE
11/26/2020,FALSE,FALSE,#NAME?,,#NAME?,#NAME?,Experience & Exchange Grants Program,Programs and projects,Environmental sciences,,,,,,,https://www.mendeley.com/research-funding/opportunities/300111662,,,,,International Association for Bear Research and Management,,,,Early Career and New Faculty Researchers,,,Mid-Career and Experienced Researchers,,,Not specified,,,,,30-nov-20,,,,#NAME?,,,,FALSE
6/16/2020,FALSE,FALSE,#NAME?,,#NAME?,#NAME?,Flexible Funding Model - Infrastructure Development and Maintenance for State Manufactured Food Regulatory Programs (U18),Contract tender or cooperative agreement,Agricultural and Biological Sciences,,,,,,,https://www.mendeley.com/research-funding/opportunities/300095937,,,,,U.S. Food and Drug Administration,,,,Local or State Governments,,,Persons with Disabilities,,,"Up to 640,000 USD with total funding of 18,000,000 USD",,,,,30-nov-20,,,,#NAME?,,,,FALSE
11/28/2021,TRUE,TRUE,#NAME?,,#NAME?,#NAME?,Global Raptor Research & Conservation Grant,Programs and projects,Conservation,,,,,,,https://hawkwatch.org/our-work/grant,proyectos liderados por ciudadanos de países en desarrollo con el objetivo de aumentar la diversidad y la inclusión en la conservación mientras se construye la capacidad local.,,,,,,,,,,,,,usd,2.500.,,,,,30-nov-20,,,,#NAME?,,,,FALSE
11/26/2020,FALSE,FALSE,#NAME?,,#NAME?,#NAME?,RESEARCH & CONSERVATION GRANTS,Research and publications,Environmental sciences,,,,,,,https://www.mendeley.com/research-funding/opportunities/300111664,,,,,International Association for Bear Research and Management,,,,Local or State Governments,,,Graduate Students,,,"Up to 15,000 USD",,,,,30-nov-20,,,,#NAME?,,,,FALSE
10-07-21,TRUE,TRUE,#NAME?,,#NAME?,#NAME?,Ornithology Research,Fellowships scholarships or trainings,Agricultural and Biological Sciences,,,,,,,https://www.amnh.org/research/vertebrate-zoology/ornithology/grants,apoya la investigación ornitológica en cualquier parte del mundo.,,,,,,,,,,,,,us,,500,3,,,30-nov-20,,,,#NAME?,,,,FALSE
10-07-21,TRUE,TRUE,#NAME?,,#NAME?,#NAME?,Schneider Electric — Go Green Student Competition: North America,Research Stays,Engineering,Sustainable Development,,,,,,https://gogreen.se.com/en/challenges/2022-north-america?lang=en,oluciones a los desafíos de casos de la vida real dentro de la gestión de la energía o ideas para una gestión eficiente de la energía.,,,,,,,,,,,,,us,1000,,,,,30-nov-20,,,,#NAME?,,,,FALSE
11/28/2021,TRUE,TRUE,#NAME?,,#NAME?,#NAME?,Rockefeller Foundation & Acumen — Food Systems Fellowship,Programs and projects,Agricultural and Biological Sciences,Engineering,Human and Social Sciences,,,,,https://acumenacademy.org/fellowship/foodsystems/,soluciones innovadoras para abordar los mayores desafíos de los sistemas alimentarios.,,,,,,,,,,,,,,,,,,,01-Dec-20,,,,#NAME?,,,,FALSE
08-02-22,TRUE,TRUE,#NAME?,publicar,#NAME?,#NAME?,XPRIZE Foundation — Carbon Removal,Prizes and Awards,Sustainable Development,Environmental sciences,,,,,,https://www.xprize.org/prizes/elonmusk/rules-and-guidelines,"crear y demostrar soluciones que puedan extraer dióxido de carbono directamente de la atmósfera o los océanos. Cualquier solución de carbono negativo es elegible: basada en la naturaleza, captura directa de aire, océanos, mineralización, etc.",,,,,,,,,,,,,USD,,1000000,"50,000,000",,,01-Dec-23,,,,#NAME?,,,,FALSE
10-07-21,TRUE,TRUE,#NAME?,,#NAME?,#NAME?,Subvenciones internacionales para la conservación de los arrecifes de coral 2022-2023,Programs and projects,Conservation,,,,,,,https://www.grants.gov/web/grants/view-opportunity.html?oppId=335826,"cooperación para proyectos internacionales de conservación de arrecifes de coral con prioridad para el Gran Caribe, el Sudeste de Asia y el Pacífico Sur, y Micronesia.",,,,,,,,,,,,,us,,US$40 thousand,US$300 thousand,,,01-Dec-20,,,,#NAME?,,,,FALSE
10-07-21,TRUE,TRUE,#NAME?,,#NAME?,#NAME?,Masters in Conservation Leadership,Fellowships scholarships or trainings,Conservation,,,,,,,https://www.geog.cam.ac.uk/graduate/mphil/applications.html,graduados con potencial de liderazgo con al menos tres a cinco años de experiencia relevante para la conservación de la biodiversidad.,,,,,,,,,,,,,,,,,,,02-Dec-20,,,,#NAME?,,,,FALSE
11/26/2020,FALSE,FALSE,#NAME?,,#NAME?,#NAME?,Research to Action: Assessing and Addressing Community Exposures to Environmental Contaminants (R01 Clinical Trial Optional),Research and publications,Environmental sciences,,,,,,,https://www.mendeley.com/research-funding/opportunities/300123003,,,,,National Institutes of Health,,,,Commercial Organizations,,,Local or State Governments,,,"Up to 400,000 USD",,,,,03-Dec-20,,,,#NAME?,,,,FALSE
10-07-21,TRUE,TRUE,#NAME?,,#NAME?,#NAME?,Ocean Stewardship Fund,Prizes and Awards,Conservation,,,,,,,https://www.msc.org/what-we-are-doing/our-collective-impact/ocean-stewardship-fund,"propuestas de investigación relacionadas con especies en peligro de extinción, amenazadas y protegidas, y con los impactos del hábitat.",,,,,,,,,,,,,libras,5000,50000,,,,06-Dec-20,,,,#NAME?,,,,FALSE
